INPUT:url	INPUT:title	INPUT:text	GOLDEN:res
https://66.ru/news/freetime/226205/	Вокалист Rammstein Тилль Линдеманн даст концерт в Екатеринбурге	Продажа билетов на шоу начнется 18 ноября, сообщается на официальном сайте тура. Вокалист Rammstein выступит в Екатеринбурге 9 марта. Тилль Линдеманн выйдет на сцену с музыкантом Петером Тэгтгреном — вместе они создали немецко-шведский дуэт под названием Lindemann. В ноябре группа выпустит второй альбом «F&M». Тур по России организуют в поддержку пластинки. «F&M» — совершенно новая глава в истории проекта. Нынешний альбом представляет лирику на немецком в исполнении Тилля Линдеманна. Отправной точкой для новых песен стало сотрудничество Тилля и Гамбургского театра «Талия». Они адаптировали сказку «Гензель и Гретель», в которой затрагиваются темы страха, надежды, бедности, излишеств, людоедства и смерти», — описывают новый альбом организаторы тура. Вот официальный клип на одну из песен «F&M», который сняли в Казахстане. Кроме Екатеринбурга Линдеманн выступит в Краснодаре, Москве и Санкт-Петербурге. 	entertainment
https://ko.com.ua/eset_dobavlyaet_polnodiskovoe_shifrovanie_v_korporativnye_produkty_130851	Eset добавляет полнодисковое шифрование в корпоративные продукты	Компания Eset выпустила новое решение для защиты конфиденциальных данных предприятия с помощью полнодискового шифрования Full Disk Encryption. Стоит отметить, что новый продукт доступен как дополнение к консолям удаленного управления защитой – Eset Cloud Administrator и Eset Security Management Center. Физическая потеря или кража устройств, таких как мобильные телефоны и ноутбуки вызывает серьезное беспокойство у многих предприятий. Кроме финансовых средств на замену устройств и выплаты высоких штрафов, потеря корпоративных данных может оказать негативное влияние на непрерывность и безопасность бизнес-процессов, а также на репутацию компании в целом. Для избежания подобных инцидентов специалисты Eset предлагают новое решение для полного шифрования диска, которое активируется удаленно и позволяет шифровать данные на подключенных устройствах в один клик. В частности, пользователи могут с одной консоли управлять статусом шифрования данных, хранящихся на корпоративных устройствах. Это ПО доступно как дополнительная функция к последним версиям решений для удаленного управления защитой Eset Cloud Administrator 1.2 и Eset Security Management Center 7.1. Стоит отметить, что продукты были специально обновлены для поддержки Eset Full Disk Encryption. Результаты исследований Eset показали, что 85% компаний (опрошено около 100 организаций) считают полнодисковое шифрование лучшей формой шифрования для защиты корпоративных данных. Кроме этого, компания IDC прогнозирует постоянный рост количества продуктов для полнодискового шифрования до 2023 г. (1,4% в год). В связи с этим компания Eset предлагает простое и эффективное решение для обеспечения защиты корпоративных данных. Вы можете подписаться на наш Telegram-канал для получения наиболее интересной информации 	technology
https://www.yuga.ru/articles/economy/8943.html	«Успех любого бизнеса определяет его репутация». Интервью с руководителем Банка ЗЕНИТ Сочи Игорем Сосиным	В январе 2020 года Банку ЗЕНИТ Сочи исполняется 30 лет. Журналист Юга.ру поговорил с председателем правления банка Игорем Сосиным об итогах работы и о том, какие перемены ждут в ближайшем будущем банк и его клиентов. Каких принципов придерживается банк и что помогает вам добиваться хороших результатов на рынке? — Во многом успех любого бизнеса, тем более банковского, зависит от его репутации. С момента своего создания Банк ЗЕНИТ Сочи определил главные принципы своей деятельности — активная работа с реальным сектором экономики и полный отказ от высокорискованных операций. Вот уже почти 30 лет руководство банка строит бизнес на принципах честности и ответственности, что позволило пережить не один банковский кризис, при этом развиваться и добиваться высоких финансовых результатов. Кроме того, с 2007 года наш банк входит в состав федеральной банковской группы ЗЕНИТ — уверен, это повышает надежность нашего регионального банка в глазах клиентов. Банк ЗЕНИТ входит в основные списки финансово устойчивых банков, подготовленные Центробанком и правительством России, а также обладает высокими рейтингами международных рейтинговых агентств. Как вы оцениваете прошедшие годы работы банка? — Мы прошли огромный путь, за который нам не стыдно! За каждой новой датой — колоссальная работа всего коллектива. Мы очень ответственно подходим к каждому новому этапу развития банка. Это ответственность перед клиентами, перед сотрудниками, и конечно, финансовая ответственность перед акционерами. Банковская группа ЗЕНИТ была образована в 2005 году. В 2007 году в нее вошли «Липецккомбанк» и «Сочигазпромбанк», который позже был переименован в Банк ЗЕНИТ Сочи.По данным на октябрь 2019 года, активы Банка ЗЕНИТ Сочи составляют 5,7 млрд рублей, чистая прибыль — 131,9 млн рублей. Контрольный пакет акций Банка ЗЕНИТ принадлежит ПАО «Татнефть». В июле СМИ сообщали, что Банк ЗЕНИТ Сочи интегрируется с Банком ЗЕНИТ. С чем это связано? Какой экономический эффект вы ожидаете получить для банка и для клиентов? — По оценкам наших специалистов, эффект от объединения дочерних структур под единым брендом «Банк ЗЕНИТ» составит 1,5 млрд рублей ежегодно. Мы ожидаем, что внедрение технологических решений, развитие цифровых каналов обслуживания и оптимизация инфраструктуры IT-платформ помогут снизить издержки и повысить эффективность работы и скорости операций. Цифровая трансформация бизнеса требует от банков колоссальных вложений, и дочерним банкам в этой гонке непросто успеть за рынком. Объединение в крупного игрока с федеральной сетью — это наш шанс стать лучшей версией себя, технологичным банком, с которым легко и удобно решать финансовые задачи. Наибольший эффект от трансформации ощутят в первую очередь наши клиенты. Как изменится доля ПАО «Татнефть» в Банке ЗЕНИТ, учитывая запланированный процесс трансформации бизнеса? — Никак не изменится. «Татнефть» продолжит быть контролирующим акционером банка, как и до слияния. Именно она проводит активную политику в отношении развития банковской группы. Поэтапный процесс интеграции под слоганом «Надежность на общем основании» был запущен в сентябре 2018 года. Интеграция банков ЗЕНИТ и ЗЕНИТ Сочи произойдет в рамках реализации трехлетней стратегии во втором квартале 2020 года. Территория присутствия Банка ЗЕНИТ Сочи — Краснодарский край, а именно — Сочи, Анапа и Краснодар. Здесь работают 5 банковских офисов и 13 банкоматов. Какие перемены будут особенно заметны для клиентов? — За годы своей работы мы завоевали существенную долю рынка Краснодарского края. Все это время мы выполняли свои задачи и ставили новые цели, руководствуясь исключительно интересами наших клиентов. Когда ЗЕНИТ Сочи станет частью универсального банка, они получат разветвленную сеть, единые стандарты обслуживания и профессиональную команду. Один из этапов интеграции — переход на единую IT-платформу, что сделает весь процесс работы быстрее и удобнее для клиента. Какие локальные перемены ожидаются в банке в процессе интеграции? — Перемен будет много, они коснутся и меня в том числе. Я перехожу с должности председателя правления АО «Банк ЗЕНИТ Сочи» на должность председателя Совета директоров. Это поможет более эффективно провести процедуру интеграции банка, а я смогу координировать работу с непосредственным руководством в головном офисе в Москве. Так будет гораздо легче поэтапно решать задачи и достигать поставленных целей, а также курировать все возникающие вопросы между коллективом Банка ЗЕНИТ Сочи и руководством Банка ЗЕНИТ в Москве.Банк продолжит исполнять свои обязательства четко и своевременно. А в канун своего дня рождения по доброй традиции окажет финансовую помощь многодетным и малообеспеченным семьям, детским дошкольным и школьным учреждениям. Какие нововведения ждут банк в 2020 году? — Все договоры продолжат действовать на тех же условиях. Тарифная политика будет соответствовать лучшим рыночным предложениям как по ценовым характеристикам, так и по наполнению продуктов. После завершения интеграции Банка ЗЕНИТ Сочи офисы будут работать под брендом «Банк ЗЕНИТ». Мы планируем максимально подробно и аргументированно рассказывать клиентам обо всех структурных изменениях и проводить консультации. БанкиДеньгиКредитованиеФинансы 	economy
https://paperpaper.ru/papernews/2019/11/10/v-manezhe-otkryvaetsya-vystavka-dajnek/	В Манеже откроется выставка Дейнеки и Самохвалова. До 17 ноября билеты можно купить за 200 рублей	В центральном выставочном зале «Манеж» 18 ноября откроется выставка «Дейнека/Самохвалов». До 17 ноября можно купить билеты онлайн по специальной цене — 200 рублей, они будут действовать на любые дни выставки. После цена билетов вырастет до 300 рублей.  На выставке представят работы двух известных советских художников — Александра Дейнеки и Александра Самохвалова. Экспозиция разделена на шесть основных разделов — война и мир, труд и спорт, герои и дети. Как отметил куратор выставки Семен Михайловский, в каждом из них есть внутренний диалог с множеством смысловых и формальных пересечений. На выставке представят 300 работ художников из 37 музеев и 9 частных коллекций. В экспозицию вошли живопись, графика, скульптура, декоративно-прикладное искусство, фотография. Проект приурочен к 120-летию со дня рождения Александра Дейнеки. В новость была добавлена информация о билетах.  	entertainment
https://euro.com.ua/autosport/2019/11/16/vilnev-hulkenberg-znaet-chto-karera-zavershena/	Вильнёв: Хюлкенберг знает, что карьера завершена	Нико Хюлкенберг остался без контракта на следующий сезон, но в Сан-Паулу заявил, что «не чувствует, что уходит из Формулы 1» – и надеется вернуться. Чемпион мира 1997 года, комментатор итальянского Sky Sport Жак Вильнёв считает такой сценарий маловероятным. Жак Вильнёв: «Нико давно в чемпионате. Ему принадлежит рекорд по числу гонок без подиумов (175), он знает, что его карьера, возможно, уже продолжается дольше, чем нужно. Но ему повезло. Ему всегда платили за работу, независимо от конкурентоспособности машин он был профессиональным гонщиком, получающим зарплату. И он очень хорошо знает, что его карьера в Формуле 1 закончилась. Он не вернётся. Нико – не молодой Эстебан Окон, которому есть что доказывать. Возможности Хюлкенберга все отлично понимают. И если не возникнет ситуации, когда кто-то заболеет и срочно понадобится замена, команды не будут смотреть в его сторону. Последней была вакансия с Alfa Romeo, но это не вариант – Фредерик Вассёр должен был взять пилота из программы Ferrari. На самом деле, всегда лучше рискнуть, пригласив парня, в котором вы сомневаетесь, чем кого-то, кто за десять лет ничего особенного не показал». 	sports
https://korrespondent.net/world/4158118-v-somaly-desiatky-chelovek-staly-zhertvamy-navodnenyia	В Сомали десятки человек стали жертвами наводнения	"Наводнение в Сомали унесло жизни по меньшей мере 25 человек, еще 47 пострадали. Об этом сообщает Синьхуа со ссылкой на данные Всемирной организации здравоохранения (ВОЗ) в пятницу, 8 ноября. Отмечается, что ливни, обрушившиеся на несколько районов Сомали, вынудили более 270 тыс. человек покинуть свои дома, разрушая средства к существованию и инфраструктуру в стране. ""Мощные дожди привели к вынужденному перемещению более 270 тыс. человек, имеется 25 погибших и 47 пострадавших"", – говорится в сообщении. Управление по координации гуманитарной деятельности ООН проинформировало, что наводнение уже затронуло свыше 547 тыс. человек. Указано, что представительство ВОЗ в Сомали оказывает ""жизненно важную экстренную помощь в сфере здравоохранения"". Напомним, в октябре во Франции из-за наводнений, вызванных сильными дождями, погибли три человека. В одном из районов за 24 часа выпало больше осадков, чем за весь год. А в испанской провинции Каталония из-за сильных дождей произошло наводнение, в результате которого погиб один человек и еще две пропали без вести. "	society
https://www.igromania.ru/news/88075/Treyler_k_vyhodu_priklyuchencheskogo_horrora_Gylt.html	Трейлер к выходу приключенческого хоррора Gylt	Разработчики из студии Tequila Works представили трейлер к выходу своего приключенческого хоррора от третьего лица Gylt. Релиз игры состоится 19 ноября только на Google Stadia. По словам разработчиков, события разворачиваются в жутком и меланхоличном мире, где смешиваются реальность и фантазия, а кошмары воплощаются в жизнь. Игрокам предстоит решать головоломки, а также сражаться с ужасными существами или скрываться от них. Некоторые игроки сравнивают Gylt с Alan Wake. Главными критериями сравнения стали не только вид от третьего лица и хоррор-составляющая, но и фонарик, который использует главная героиня игры, чтобы уничтожать чудовищ. Отметим, что Gylt оказалась единственным эксклюзивом Google Stadia, который попал в стартовую линейку сервиса. Всего на старте будет 12 игр, включая Red Dead Redemption 2, а до конца года библиотека сервиса расширится до 26 игр. Когда Stadia заработает в России — неизвестно. 	entertainment
https://dtf.ru/esport/113183-oficialno-kitayskiy-klub-funplus-phoenix-vykupil-datskiy-sostav-heroic-po-cs-go	Официально: китайский клуб FunPlus Phoenix выкупил датский состав Heroic по CS:GO	Об этом известная китайская организация рассказала в официальном твиттере. FunPlus Phoenix — чемпион мира по League of Legends. В анонсе сообщается, что состав выкупили специально для участия в первой франшизной лиге по CS:GO — Flashpoint. FunPlus выступит на чемпионате на правах спонсора — клуб будет получать процент с доходов лиги. Организация должна была внести 2 миллиона долларов для получения франшизы. Возможно, FunPlus Phoenix этого не делала — такую информацию сообщил инсайдер NeL, ссылаясь на свои источники. Также он назвал возможную сумму трансфера между китайским клубом и Heroic.	sports
